{
  "job_id": "sample-project",
  "status": "succeeded_with_fallbacks",
  "summary": "Visual generation skipped; fallback placeholders used.",
  "provider": "fallback",
  "slide_results": [
    {
      "slide_index": 0,
      "mode": "region",
      "status": "fallback_used",
      "fallback": "placeholder",
      "manual_review": true
    },
    {
      "slide_index": 1,
      "mode": "region",
      "status": "fallback_used",
      "fallback": "placeholder",
      "manual_review": true
    },
    {
      "slide_index": 2,
      "mode": "region",
      "status": "fallback_used",
      "fallback": "placeholder",
      "manual_review": true
    },
    {
      "slide_index": 3,
      "mode": "region",
      "status": "fallback_used",
      "fallback": "placeholder",
      "manual_review": true
    },
    {
      "slide_index": 4,
      "mode": "region",
      "status": "fallback_used",
      "fallback": "placeholder",
      "manual_review": true
    },
    {
      "slide_index": 5,
      "mode": "region",
      "status": "fallback_used",
      "fallback": "placeholder",
      "manual_review": true
    },
    {
      "slide_index": 6,
      "mode": "region",
      "status": "fallback_used",
      "fallback": "placeholder",
      "manual_review": true
    },
    {
      "slide_index": 7,
      "mode": "region",
      "status": "fallback_used",
      "fallback": "placeholder",
      "manual_review": true
    }
  ],
  "warnings": [
    "External visual generation was not configured."
  ]
}
